id,subreddit,title,post_body,number of comments,time_posted,time_now,time_difference
uzz4yd,facepalm,Show me,,1413,2022-05-28 23:47:41.000000,2022-05-29 03:17:37.780016,0 days 03:29:56.780016
uzysdi,WhitePeopleTwitter,Her name was Michelle Snow and she was almost 8,,577,2022-05-28 23:27:57.000000,2022-05-29 03:17:37.780016,0 days 03:49:40.780016
uzz6t5,movies,"Dear god, no, Morbius 2 has not been greenlit",,1001,2022-05-28 23:50:22.000000,2022-05-29 03:17:37.780016,0 days 03:27:15.780016
uzwk33,funny,So Costco apparently doesn't re-take membership card photos if you sneeze,,792,2022-05-28 21:28:11.000000,2022-05-29 03:17:37.780016,0 days 05:49:26.780016
uzzxuf,oddlysatisfying,How to draw balls,,416,2022-05-29 00:33:47.000000,2022-05-29 03:17:37.780016,0 days 02:43:50.780016
v00u7x,IdiotsInCars,My dad has been an over the road trucker for 40 years and has never had an accident… until today.,,563,2022-05-29 01:28:47.000000,2022-05-29 03:17:37.780016,0 days 01:48:50.780016
uzw39a,worldnews,Lithuanian citizens pool $4.7M to buy advanced drone for Ukraine's military,,668,2022-05-28 21:02:30.000000,2022-05-29 03:17:37.780016,0 days 06:15:07.780016
uzwo43,gifs,Unadulterated reaction,,864,2022-05-28 21:34:23.000000,2022-05-29 03:17:37.780016,0 days 05:43:14.780016
uzvljx,LeopardsAteMyFace,Party Obsessed with Vote Fraud Caught in Massive Vote Fraud Scheme,,1151,2022-05-28 20:35:33.000000,2022-05-29 03:17:37.780016,0 days 06:42:04.780016
v001tn,blackmagicfuckery,Laminar Flow,,86,2022-05-29 00:40:27.000000,2022-05-29 03:17:37.780016,0 days 02:37:10.780016
uzxk6p,interestingasfuck,The Paper that allows you to see where magnets are located inside of the devices,,201,2022-05-28 22:20:57.000000,2022-05-29 03:17:37.780016,0 days 04:56:40.780016
uzyv3r,Superstonk,Missed a huge RC Tweet by 15 hours. Time to pay up: it’s mayo time!,,897,2022-05-28 23:32:22.000000,2022-05-29 03:17:37.780016,0 days 03:45:15.780016
uzyf05,pics,[OC] Bought The Handmaid’s Tale for $1. Turns out it’s a 1st edition signed by Margaret Atwood!,,134,2022-05-28 23:07:07.000000,2022-05-29 03:17:37.780016,0 days 04:10:30.780016
uzws4b,futurama,I'm Swelling With Patriotic Mucus!,,49,2022-05-28 21:40:20.000000,2022-05-29 03:17:37.780016,0 days 05:37:17.780016
uzzn7x,gaming,Finally finished my World of Warcraft Dwarf cosplay! (OC),,121,2022-05-29 00:15:58.000000,2022-05-29 03:17:37.780016,0 days 03:01:39.780016
uzu7up,WitchesVsPatriarchy,2 kinds of dryads,,128,2022-05-28 19:21:14.000000,2022-05-29 03:17:37.780016,0 days 07:56:23.780016
uzzwvs,wholesomememes,Comfort smells *sniff sniff*,,42,2022-05-29 00:32:06.000000,2022-05-29 03:17:37.780016,0 days 02:45:31.780016
uzwoaj,economy,"“All the Covid stay-at-home stuff has tricked people into thinking that you don't actually need to work hard"" said the billionaire oligarch who has received billions in federal loans and tax breaks. That is, other people's money. He is mocking the entire working class straight.",,847,2022-05-28 21:34:39.000000,2022-05-29 03:17:37.780016,0 days 05:42:58.780016
uztqce,aww,"Two ❤ sweet little travellers in Pokrovsk railway station, Donetsk, Ukraine.🇺🇦",,322,2022-05-28 18:56:13.000000,2022-05-29 03:17:37.780016,0 days 08:21:24.780016
uzutsr,mildlyinteresting,I have a Del Taco coupon that expires in the year 2106.,,422,2022-05-28 19:53:33.000000,2022-05-29 03:17:37.780016,0 days 07:24:04.780016
v006l3,todayilearned,"TIL that a fire destroyed most of Harvard Library’s collection in 1764. Only a small number of books were spared, including 144 that were checked out at the time. One of these books was found and returned in 1997.",,53,2022-05-29 00:48:25.000000,2022-05-29 03:17:37.780016,0 days 02:29:12.780016
uzwrkl,blursedimages,blursed_demon,,45,2022-05-28 21:39:31.000000,2022-05-29 03:17:37.780016,0 days 05:38:06.780016
uzssqd,news,Police inaction moves to center of Uvalde shooting probe,,4907,2022-05-28 18:07:11.000000,2022-05-29 03:17:37.780016,0 days 09:10:26.780016
uzuhlr,Damnthatsinteresting,Diving cat.,,474,2022-05-28 19:35:29.000000,2022-05-29 03:17:37.780016,0 days 07:42:08.780016
uztuwc,mildlyinfuriating,"Gave specific, easy to follow instructions, on how to deliver to my unit. They decided to just leave the delivery in the main lobby.",,3162,2022-05-28 19:02:28.000000,2022-05-29 03:17:37.780016,0 days 08:15:09.780016
uztuge,woodworking,I made a bookshelf for a safari themed nursery.,,278,2022-05-28 19:01:50.000000,2022-05-29 03:17:37.780016,0 days 08:15:47.780016
uzxehq,ContagiousLaughter,I just introduced my stepbrother to the world of Snapchat filters,,92,2022-05-28 22:12:54.000000,2022-05-29 03:17:37.780016,0 days 05:04:43.780016
uzurhr,LateStageCapitalism,Too soon?,,90,2022-05-28 19:50:10.000000,2022-05-29 03:17:37.780016,0 days 07:27:27.780016
uzv5o2,dndmemes,I don't think I have the strength,,177,2022-05-28 20:11:00.000000,2022-05-29 03:17:37.780016,0 days 07:06:37.780016
uzz1qy,HumansBeingBros,"My neighbor knows I have RA & am recovering from COVID... This morning, she bought a new tree for me, planted it, got some neighbors to help, and gave me her puppy to hold while she was doing it.",,67,2022-05-28 23:42:47.000000,2022-05-29 03:17:37.780016,0 days 03:34:50.780016
uztcgg,Whatcouldgowrong,WCGW pushing this wall over,,498,2022-05-28 18:35:22.000000,2022-05-29 03:17:37.780016,0 days 08:42:15.780016
uzt1q5,dankmemes,This is my therapy making inappropriate memes about events I don’t know how to process.,,465,2022-05-28 18:20:12.000000,2022-05-29 03:17:37.780016,0 days 08:57:25.780016
uzyygj,HolUp,Profit,,142,2022-05-28 23:37:37.000000,2022-05-29 03:17:37.780016,0 days 03:40:00.780016
uzs74s,science,"Ancient proteins confirm that first Australians, around 50,000, ate giant melon-sized eggs of around 1.5 kg of huge extincted flightless birds",,1355,2022-05-28 17:36:03.000000,2022-05-29 03:17:37.780016,0 days 09:41:34.780016
uzuzt0,LifeProTips,"LPT: If you're having a discussion/argument with someone and they admit they're wrong, don't rub it in their faces. Most people struggle with admitting when they're wrong as it is, mostly because of the way others react when they voice it out loud.",,144,2022-05-28 20:02:16.000000,2022-05-29 03:17:37.780016,0 days 07:15:21.780016
uzsghf,antiwork,"How Young People Get Their Antiwork Frame of Mind, Due to Being Not Taught Well in School!",,1225,2022-05-28 17:49:38.000000,2022-05-29 03:17:37.780016,0 days 09:27:59.780016
v0096z,NatureIsFuckingLit,🔥 Driver has a rare close encounter with a Canadian Lynx and her kittens,,37,2022-05-29 00:52:53.000000,2022-05-29 03:17:37.780016,0 days 02:24:44.780016
uzvq22,educationalgifs,Fur and sheepskin sewing machine,,57,2022-05-28 20:42:08.000000,2022-05-29 03:17:37.780016,0 days 06:35:29.780016
uzsghn,MadeMeSmile,She became the first person in her family to graduate!,,69,2022-05-28 17:49:39.000000,2022-05-29 03:17:37.780016,0 days 09:27:58.780016
uzxiq5,wallstreetbets,Innovation baby,,84,2022-05-28 22:18:54.000000,2022-05-29 03:17:37.780016,0 days 04:58:43.780016
uzt3tl,memes,I'm scared of how their home bathroom looks,,227,2022-05-28 18:23:13.000000,2022-05-29 03:17:37.780016,0 days 08:54:24.780016
uzxpjm,TIHI,"Thanks, I hate training future school shooters.",,159,2022-05-28 22:28:48.000000,2022-05-29 03:17:37.780016,0 days 04:48:49.780016
uzrh8x,politics,"Texas Senate Democrats call for special session to raise age to purchase gun, require universal background checks",,801,2022-05-28 17:00:55.000000,2022-05-29 03:17:37.780016,0 days 10:16:42.780016
uzuwv5,OldSchoolCool,Me (50m) and My Brother (52m) in the late 80s,,354,2022-05-28 19:58:12.000000,2022-05-29 03:17:37.780016,0 days 07:19:25.780016
uzskyp,PeopleFuckingDying,CaT tRapPed tO SuFfocaTe aNd DiE,,92,2022-05-28 17:56:23.000000,2022-05-29 03:17:37.780016,0 days 09:21:14.780016
uzqymx,SelfAwarewolves,One of the Uvalde officers via an interview with People Magazine.,,2025,2022-05-28 16:34:43.000000,2022-05-29 03:17:37.780016,0 days 10:42:54.780016
uzr1h5,blessedimages,Blessed ID Photo,,193,2022-05-28 16:38:50.000000,2022-05-29 03:17:37.780016,0 days 10:38:47.780016
uzzrh5,Unexpected,He's got a point,,82,2022-05-29 00:23:01.000000,2022-05-29 03:17:37.780016,0 days 02:54:36.780016
uztr0u,lotrmemes,Give it to us raw and wriggling,,80,2022-05-28 18:57:12.000000,2022-05-29 03:17:37.780016,0 days 08:20:25.780016
uzv9yb,CrappyDesign,This terrible church advert,,290,2022-05-28 20:17:49.000000,2022-05-29 03:17:37.780016,0 days 06:59:48.780016
uzr7f9,tumblr,"Well, who is feeding the cat?",,134,2022-05-28 16:47:22.000000,2022-05-29 03:17:37.780016,0 days 10:30:15.780016
uztbwf,PrequelMemes,"“You didn’t suggest this place because Star Wars was filmed here, right?” “Na boo”",,62,2022-05-28 18:34:31.000000,2022-05-29 03:17:37.780016,0 days 08:43:06.780016
uzx5x5,StarWars,Who wouldn’t love to watch the prequels again with this commentary,,64,2022-05-28 22:00:22.000000,2022-05-29 03:17:37.780016,0 days 05:17:15.780016
uzubhd,AnimalsBeingDerps,"Come closer, I just wanna lick ya",,163,2022-05-28 19:26:28.000000,2022-05-29 03:17:37.780016,0 days 07:51:09.780016
uzqu1l,AbruptChaos,Removing a wasp nest in style.,,667,2022-05-28 16:28:10.000000,2022-05-29 03:17:37.780016,0 days 10:49:27.780016
uzr1bj,ProgrammerHumor,*taps shit on keyboard* i am in,,302,2022-05-28 16:38:38.000000,2022-05-29 03:17:37.780016,0 days 10:38:59.780016
uzuvqo,FunnyAnimals,"I found it a few meters from my house, abandoned and very hungry, I'm going to give him a bath and I'm still deciding on a name for him.",,578,2022-05-28 19:56:25.000000,2022-05-29 03:17:37.780016,0 days 07:21:12.780016
uzxwi4,Eyebleach,The one who lives in your garden...,,49,2022-05-28 22:39:10.000000,2022-05-29 03:17:37.780016,0 days 04:38:27.780016
uzqjaw,Eldenring,Slick mf. Here’s proof Glintstone Crowns raise your intelligence.,,646,2022-05-28 16:13:13.000000,2022-05-29 03:17:37.780016,0 days 11:04:24.780016
uzwdox,cats,Found this really really smol kitter today.,,75,2022-05-28 21:18:32.000000,2022-05-29 03:17:37.780016,0 days 05:59:05.780016
uztsj2,BetterEveryLoop,smooth bike moves,,60,2022-05-28 18:59:23.000000,2022-05-29 03:17:37.780016,0 days 08:18:14.780016
uzstt6,nextfuckinglevel,"This boy's parents were worried he'd be lonely on his birthday as they had recently moved, so they asked if people could send him cards. Ryan Reynolds found out and he did the most Ryan Reynolds thing ever. This was the boy's reaction.",,390,2022-05-28 18:08:47.000000,2022-05-29 03:17:37.780016,0 days 09:08:50.780016
uzr84c,Art,"Lost Email, Me, Digital, 2022",,118,2022-05-28 16:48:23.000000,2022-05-29 03:17:37.780016,0 days 10:29:14.780016
uzvb6g,hmm,hmm?,,121,2022-05-28 20:19:50.000000,2022-05-29 03:17:37.780016,0 days 06:57:47.780016
v00tb8,worldnews,Ukraine's intelligence chief 'fully confirms' Vladimir Putin has cancer,,556,2022-05-29 01:27:08.000000,2022-05-29 03:17:37.780016,0 days 01:50:29.780016
uzvwga,ShitPostCrusaders,Requirement to be Joseph's friend,,75,2022-05-28 20:52:07.000000,2022-05-29 03:17:37.780016,0 days 06:25:30.780016
uzq2hz,nursing,Accountability is not equal,,949,2022-05-28 15:50:44.000000,2022-05-29 03:17:37.780016,0 days 11:26:53.780016
uzsv4m,TwoXChromosomes,"I've finally found myself over these last three years! Left - Before, Right - After",,455,2022-05-28 18:10:41.000000,2022-05-29 03:17:37.780016,0 days 09:06:56.780016
uzy59b,trashy,Florida man,,165,2022-05-28 22:52:20.000000,2022-05-29 03:17:37.780016,0 days 04:25:17.780016
uzyzl4,unpopularopinion,Weed addiction is a serious issue,"Speaking as an avid pot smoker it’s annoying when people treat weed addiction like it’s not a “real addiction”. Yeah, as far as recreational drugs go it’s pretty harmless; it’s less toxic than alcohol, not chemically addictive, withdrawals aren’t physically painful, but it can still fuck up your life. Constantly getting stoned robs you of your motivation and impairs your ability to function like a normal person.

It’s also way more difficult to quit than most people think, especially if you’ve made it a daily habit. Trying to taper off rarely works because it’s so easy to smoke casually that you’ll never struggle to find an excuse for it. Going cold turkey sucks because you become irritable and impatient, your brain having been flooded with dopamine for so long that the things that would make a normal person happy have no effect on you.

Obviously it’s not as bad as Xanax, meth, heroin, etc, but it can still mess you up.",603,2022-05-28 23:39:26.000000,2022-05-29 03:17:37.780016,0 days 03:38:11.780016
v00szl,clevercomebacks,Point to verse in the Bible,,78,2022-05-29 01:26:30.000000,2022-05-29 03:17:37.780016,0 days 01:51:07.780016
uzu3nv,WhitePeopleTwitter,"""Angry Oinking Noises""",,441,2022-05-28 19:15:07.000000,2022-05-29 03:17:37.780016,0 days 08:02:30.780016
uzrgr3,shittymoviedetails,"In Avengers (2012) there are zero cops or military during an alien invasions, this is a realistic depiction of the modern-day American police force.",,228,2022-05-28 17:00:15.000000,2022-05-29 03:17:37.780016,0 days 10:17:22.780016
uzr672,starterpacks,Exclusive Resort Starter Pack,,329,2022-05-28 16:45:37.000000,2022-05-29 03:17:37.780016,0 days 10:32:00.780016
uzt6o9,space,"There are plans to turn Buzz Aldrin's childhood home in New Jersey into a museum. The annual cost to maintain and run the museum will be about $290,000, including $160,000 in salary for four staffers",,469,2022-05-28 18:27:19.000000,2022-05-29 03:17:37.780016,0 days 08:50:18.780016
uztz9b,AdviceAnimals,if you're in America,,358,2022-05-28 19:08:44.000000,2022-05-29 03:17:37.780016,0 days 08:08:53.780016
uzrg46,formula1,This is why Monaco should be on the calendar.,,515,2022-05-28 16:59:37.000000,2022-05-29 03:17:37.780016,0 days 10:18:00.780016
uzqe10,lifehacks,Seems like a lifehack to me.,,459,2022-05-28 16:06:05.000000,2022-05-29 03:17:37.780016,0 days 11:11:32.780016
uzty7c,AnimalsBeingBros,Just the two of us,,50,2022-05-28 19:07:12.000000,2022-05-29 03:17:37.780016,0 days 08:10:25.780016
uzsdw9,Showerthoughts,"For one of the most vulgar and violent video games ever made, GTA has no schools anywhere on the map.",,488,2022-05-28 17:45:47.000000,2022-05-29 03:17:37.780016,0 days 09:31:50.780016
uzyi3k,DemocraticSocialism,Buttigieg gets called out on his lies,,47,2022-05-28 23:11:51.000000,2022-05-29 03:17:37.780016,0 days 04:05:46.780016
uzuotb,me_irlgbt,me_irlgbt,,81,2022-05-28 19:46:13.000000,2022-05-29 03:17:37.780016,0 days 07:31:24.780016
uzwogm,realmadrid,Give it up for my guy Thibau! Absolute monster!!,,237,2022-05-28 21:34:55.000000,2022-05-29 03:17:37.780016,0 days 05:42:42.780016
uzsxiq,shitposting,deserved,,67,2022-05-28 18:14:11.000000,2022-05-29 03:17:37.780016,0 days 09:03:26.780016
uzxczy,houseplants,I love making macrame plant hangers! 🌿 ❤️ What do you think?,,122,2022-05-28 22:10:41.000000,2022-05-29 03:17:37.780016,0 days 05:06:56.780016
uzormw,comics,dealing with a depressive episode so I'm making myself draw stick figures,,323,2022-05-28 14:44:35.000000,2022-05-29 03:17:37.780016,0 days 12:33:02.780016
uzwons,reddevils,Sorry Liverpool there’s still only one treble winning side in England ;),,387,2022-05-28 21:35:12.000000,2022-05-29 03:17:37.780016,0 days 05:42:25.780016
uzs2l2,fuckcars,Phoenix is a Monument to Man's Arrogance,,338,2022-05-28 17:29:47.000000,2022-05-29 03:17:37.780016,0 days 09:47:50.780016
uzw005,pokemongo,Please It’s enough,,36,2022-05-28 20:57:47.000000,2022-05-29 03:17:37.780016,0 days 06:19:50.780016
uzt9c9,cursedcomments,cursed_santa,,21,2022-05-28 18:31:01.000000,2022-05-29 03:17:37.780016,0 days 08:46:36.780016
uzqzwu,IllegallySmolCats,"Reddit, Kumquat. Kumquat, Reddit.",,147,2022-05-28 16:36:33.000000,2022-05-29 03:17:37.780016,0 days 10:41:04.780016
uzpob0,greentext,Room mate problems,,220,2022-05-28 15:30:37.000000,2022-05-29 03:17:37.780016,0 days 11:47:00.780016
uzqdbm,nottheonion,"Sen. Ron Johnson says critical race theory, 'wokeness' responsible for school shootings",,811,2022-05-28 16:05:06.000000,2022-05-29 03:17:37.780016,0 days 11:12:31.780016
uzpwmw,CatastrophicFailure,"Motor yacht fire in Torquay, UK 28/5/22",,510,2022-05-28 15:42:28.000000,2022-05-29 03:17:37.780016,0 days 11:35:09.780016
uzu4v4,wholesomegreentext,anon accidentally saves his dad,,62,2022-05-28 19:16:50.000000,2022-05-29 03:17:37.780016,0 days 08:00:47.780016
uzs8e2,DiWHY,unbreakable lead pencil y??,,311,2022-05-28 17:37:48.000000,2022-05-29 03:17:37.780016,0 days 09:39:49.780016
uzzpm7,BlackPeopleTwitter,Don’t wanna be cologne-fished.,,155,2022-05-29 00:19:58.000000,2022-05-29 03:17:37.780016,0 days 02:57:39.780016
uzuvwy,news,San Francisco Giants manager: 'I don't plan on coming out for the anthem going forward until I feel better about the direction of our country',,750,2022-05-28 19:56:41.000000,2022-05-29 03:17:37.780016,0 days 07:20:56.780016
uzt7ud,baseball,[Highlight] Mike Trout rips a homer off Beckham Aaron Trout,,235,2022-05-28 18:28:57.000000,2022-05-29 03:17:37.780016,0 days 08:48:40.780016
uzophn,PoliticalHumor,Dancing on their graves,,707,2022-05-28 14:41:22.000000,2022-05-29 03:17:37.780016,0 days 12:36:15.780016
uzzpm7,BlackPeopleTwitter,Don’t wanna be cologne-fished.,,155,2022-05-29 00:19:58.000000,2022-05-29 03:17:39.617327,0 days 02:57:41.617327
uzuvwy,news,San Francisco Giants manager: 'I don't plan on coming out for the anthem going forward until I feel better about the direction of our country',,750,2022-05-28 19:56:41.000000,2022-05-29 03:17:39.617327,0 days 07:20:58.617327
uzwfwm,KitchenConfidential,I knocked over the granola during brunch today. Whew.,,88,2022-05-28 21:21:46.000000,2022-05-29 03:17:39.617327,0 days 05:55:53.617327
uzxay2,marvelmemes,it was the teachers fault probably,,8,2022-05-28 22:07:34.000000,2022-05-29 03:17:39.617327,0 days 05:10:05.617327
uzo54a,KidsAreFuckingStupid,probably because she was hungry,,221,2022-05-28 14:11:01.000000,2022-05-29 03:17:39.617327,0 days 13:06:38.617327
uzqqig,WhatsWrongWithYourDog,My old bulldog compared to my new. I thought the old had attitude. Lord help me.,,104,2022-05-28 16:23:08.000000,2022-05-29 03:17:39.617327,0 days 10:54:31.617327
uzq5op,PublicFreakout,The full video of the interaction with Ted Cruz in the restaurant.,,1182,2022-05-28 15:55:11.000000,2022-05-29 03:17:39.617327,0 days 11:22:28.617327
uznqgo,CasualUK,This is what happens when you block the tram in Sheffield,,1518,2022-05-28 13:49:42.000000,2022-05-29 03:17:39.617327,0 days 13:27:57.617327
uzwy0z,starwarsmemes,"""Like you trained his father?""",,20,2022-05-28 21:49:13.000000,2022-05-29 03:17:39.617327,0 days 05:28:26.617327
uzp549,Wellthatsucks,You know my pain.,,443,2022-05-28 15:03:28.000000,2022-05-29 03:17:39.617327,0 days 12:14:11.617327
uzvt2c,OnePiece,Turned my daughter into a One Piece character,,93,2022-05-28 20:46:49.000000,2022-05-29 03:17:39.617327,0 days 06:30:50.617327
uzp7ua,WTF,"Woke up to what we thought was a dead opossum, I didn't know I was gonna be doing this this morning. possibly NSFW",,1053,2022-05-28 15:07:15.000000,2022-05-29 03:17:39.617327,0 days 12:10:24.617327
uzucs7,MoldyMemes,.,,58,2022-05-28 19:28:31.000000,2022-05-29 03:17:39.617327,0 days 07:49:08.617327
uzpw21,TikTokCringe,The main character's wife who dies near the beginning of the movie.,,175,2022-05-28 15:41:36.000000,2022-05-29 03:17:39.617327,0 days 11:36:03.617327
uzqp3x,awfuleverything,Health insurance in America,,379,2022-05-28 16:21:02.000000,2022-05-29 03:17:39.617327,0 days 10:56:37.617327
uzspqv,gifsthatendtoosoon,"C’mere. No, you c’mere.",,68,2022-05-28 18:02:56.000000,2022-05-29 03:17:39.617327,0 days 09:14:43.617327
uzvrkc,whenthe,"Flat refers to: Butt, Breast, Vagina, Stomach, Eyes...",,41,2022-05-28 20:44:21.000000,2022-05-29 03:17:39.617327,0 days 06:33:18.617327
uzp0kv,sewing,I made a two-piece outfit,,122,2022-05-28 14:57:33.000000,2022-05-29 03:17:39.617327,0 days 12:20:06.617327
uzqhyn,trippinthroughtime,lincoln’s fax,,64,2022-05-28 16:11:31.000000,2022-05-29 03:17:39.617327,0 days 11:06:08.617327
uzoark,formuladank,Red Flag in Monaco,,113,2022-05-28 14:19:23.000000,2022-05-29 03:17:39.617327,0 days 12:58:16.617327
uzpicf,books,George RR Martin: ‘I don’t understand how people can come to hate so much something that they once loved’,,2785,2022-05-28 15:22:05.000000,2022-05-29 03:17:39.617327,0 days 11:55:34.617327
uznelz,CozyPlaces,The interior of my 33' sailboat,,608,2022-05-28 13:31:24.000000,2022-05-29 03:17:39.617327,0 days 13:46:15.617327
uzwazx,DramaticText,"Run Belle, run",,146,2022-05-28 21:14:24.000000,2022-05-29 03:17:39.617327,0 days 06:03:15.617327
uzvwwl,blackcats,Went to the shelter yesterday to adopt a dog- got hexed and came home with this cutie pie instead,,99,2022-05-28 20:52:52.000000,2022-05-29 03:17:39.617327,0 days 06:24:47.617327
uzpl9i,maybemaybemaybe,Maybe maybe maybe,,245,2022-05-28 15:26:15.000000,2022-05-29 03:17:39.617327,0 days 11:51:24.617327
uzwy43,LivestreamFail,Mizkif asks 11 year old Adin Ross fan if he gambles,,301,2022-05-28 21:49:21.000000,2022-05-29 03:17:39.617327,0 days 05:28:18.617327
uzu89i,tf2,Browsing r/tf2 on 28.05.2022 be like:,,57,2022-05-28 19:21:46.000000,2022-05-29 03:17:39.617327,0 days 07:55:53.617327
uznwkr,natureismetal,I renested a baby bluebird and went to check on him the next morning...,,600,2022-05-28 13:58:58.000000,2022-05-29 03:17:39.617327,0 days 13:18:41.617327
uzp5vg,yesyesyesyesno,When life gives you lemons…?,,685,2022-05-28 15:04:28.000000,2022-05-29 03:17:39.617327,0 days 12:13:11.617327
uzs7zd,me_irl,me_irl,,67,2022-05-28 17:37:15.000000,2022-05-29 03:17:39.617327,0 days 09:40:24.617327
uzx2b6,PoliticalCompassMemes,巨球,,468,2022-05-28 21:55:25.000000,2022-05-29 03:17:39.617327,0 days 05:22:14.617327
uzpg0y,likeus,Little monkey exhibits cognitive dissonance when she realizes the hand she is holding is not her mom's but a stranger's,,288,2022-05-28 15:18:48.000000,2022-05-29 03:17:39.617327,0 days 11:58:51.617327
uzqy8n,adhdmeme,Quitting smoking was a multi-year experience for this reason 😂,,78,2022-05-28 16:34:11.000000,2022-05-29 03:17:39.617327,0 days 10:43:28.617327
uzvzzv,lego,I'm a teacher and one of my parents is a tattoo artist. He gifted me a free tattoo for appreciation week and I just HAD to take the chance to show my favorite minifig some love: Benny the Spaceman!,,58,2022-05-28 20:57:46.000000,2022-05-29 03:17:39.617327,0 days 06:19:53.617327
uzv788,iamverysmart,A real baby Genius,,121,2022-05-28 20:13:29.000000,2022-05-29 03:17:39.617327,0 days 07:04:10.617327
uzz4kt,toptalent,Cartoon vs. Realistic Drawing,,28,2022-05-28 23:47:07.000000,2022-05-29 03:17:39.617327,0 days 03:30:32.617327
uzz0tv,MadeMeSmile,Bride gets surprised with all the children she works with being included in her wedding.,,58,2022-05-28 23:41:23.000000,2022-05-29 03:17:39.617327,0 days 03:36:16.617327
uzvie3,ukraine,Ukrainian mig-29 with full afterburner. The Ukrainian Air force still flies💪,,136,2022-05-28 20:30:51.000000,2022-05-29 03:17:39.617327,0 days 06:46:48.617327
uzu4kw,Minecraft,"As requested by 7yo, an entire Minecraft village as birthday cake!",,40,2022-05-28 19:16:25.000000,2022-05-29 03:17:39.617327,0 days 08:01:14.617327
uzpkb7,rickandmorty,This scene was unforgettable for me.,,112,2022-05-28 15:24:49.000000,2022-05-29 03:17:39.617327,0 days 11:52:50.617327
uzx1gg,nostalgia,Cashing in on a free Book It pizza and renting some games and a movie.,,65,2022-05-28 21:54:12.000000,2022-05-29 03:17:39.617327,0 days 05:23:27.617327
uzq7c6,DnD,"Going through my dads things after he passed, I found his character sheet.","My dad recently passed and I was going through his paperwork to close any accounts, etc. Among a folder of important things he saved, this is one of them.   


Years ago I ran a one-shot for him when he was visiting me from another province and this is the character I helped him make. He was 65 when we played D&D together for the first time and he loved it. I remember one specific moment where the party was ambushed by orcs and he was laying low on top of the wagon they were travelling with. Well, the fighter was grappled by one particular orc and my dad asked ""Can I slowly pull out one of my swords and try and leap down on top of him?"". Obviously yes (every DM says to an awesome question like this). No word of a lie he rolled a natural 20 for his first attack and we all shared that collective moment of yelling and laughing. The excitement he had when he described how he cuts the orc down and saved his friend was a thing of beauty. D&D poetry if you ask me. 

My dad may be gone but at least I know that Klondyke, the NE Tiefling Ranger is out there somewhere trying to get by, by whatever means necessary. 

Edit: My goodness you're all such incredible people. Thank you all so much for the gestures and the comments and the awards and private messages. D&D people are wonderful people. I'm deeply moved by all of you. I've crossposted in r/adventuresofgalder as was suggested by several of you. It brings me immense joy that Klondyke may live on in other games. To those of who who have asked, please feel free to use Klondyke in your game if you so desire. My dad would be absolutely thrilled to see all of you raising your toasts to him. Much thank you to all. To Klondyke! 🍻

https://preview.redd.it/a8yqiddtl8291.jpg?width=2789&format=pjpg&auto=webp&s=b5daa2a2472445c12b336118d77e60113513fd55",301,2022-05-28 15:57:26.000000,2022-05-29 03:17:39.617327,0 days 11:20:13.617327
uztv2l,Catswithjobs,Gaming cat pad,,28,2022-05-28 19:02:42.000000,2022-05-29 03:17:39.617327,0 days 08:14:57.617327
uzwcav,Hololive,Fauna demonstrates the versatility of OOOO,,31,2022-05-28 21:16:20.000000,2022-05-29 03:17:39.617327,0 days 06:01:19.617327
uzr0x7,interestingasfuck,An Elephant Family sleeping photographed by a drone,,388,2022-05-28 16:38:04.000000,2022-05-29 03:17:39.617327,0 days 10:39:35.617327
