id,subreddit,title,post_body,number of comments,time_posted,time_now,time_difference
uztdsu,aww,8.5 weeks pregnant mamma cat,,92,2022-05-28 18:37:20.000000,2022-05-29 03:17:55.354702,0 days 08:40:35.354702
uzr8m6,magicthecirclejerking,Man's best friend,,9,2022-05-28 16:49:06.000000,2022-05-29 03:17:55.354702,0 days 10:28:49.354702
uzyawb,montreal,Objectif Montréal,,9,2022-05-28 23:01:05.000000,2022-05-29 03:17:55.354702,0 days 04:16:50.354702
uzq4zn,TrashTaste,How to not look poor,,37,2022-05-28 15:54:17.000000,2022-05-29 03:17:55.354702,0 days 11:23:38.354702
uzy60e,blackpeoplegifs,Mans straight up playing the booty bongos,,10,2022-05-28 22:53:35.000000,2022-05-29 03:17:55.354702,0 days 04:24:20.354702
uzyu4s,NASCAR,Fox Sports refusing to cut to a battle on the track until Harvick literally begs them,,112,2022-05-28 23:30:47.000000,2022-05-29 03:17:55.354702,0 days 03:47:08.354702
uzlgj5,Animemes,Being creative is the key.,,91,2022-05-28 11:33:57.000000,2022-05-29 03:17:55.354702,0 days 15:43:58.354702
uzpw0q,AmongUs,I've left a lot of bodies in the cafeteria...,,11,2022-05-28 15:41:33.000000,2022-05-29 03:17:55.354702,0 days 11:36:22.354702
uzq7qj,seniorkitties,"RIP Midnight, My Sweet Baby Boy",,45,2022-05-28 15:57:59.000000,2022-05-29 03:17:55.354702,0 days 11:19:56.354702
uznreo,mathmemes,How kids learn math now,,42,2022-05-28 13:51:07.000000,2022-05-29 03:17:55.354702,0 days 13:26:48.354702
uzwl9c,woahdude,Helga Stentzel uses laundry to create amazing farm animals,,11,2022-05-28 21:30:02.000000,2022-05-29 03:17:55.354702,0 days 05:47:53.354702
uzxzja,rupaulsdragrace,This legend and her love for details really served,,29,2022-05-28 22:43:36.000000,2022-05-29 03:17:55.354702,0 days 04:34:19.354702
uzztrk,DevilMayCry,#DMC2SWEEP,,21,2022-05-29 00:26:55.000000,2022-05-29 03:17:55.354702,0 days 02:51:00.354702
uzsvg5,PrincessesOfPower,Will they meet again?!,,13,2022-05-28 18:11:10.000000,2022-05-29 03:17:55.354702,0 days 09:06:45.354702
uzs5te,PhoenixSC,Render by me.,,3,2022-05-28 17:34:15.000000,2022-05-29 03:17:55.354702,0 days 09:43:40.354702
uznqwc,Scotland,Glasgow leaders under fire for not hosting celebrations for Jubilee,,358,2022-05-28 13:50:22.000000,2022-05-29 03:17:55.354702,0 days 13:27:33.354702
uzp3kw,araragi,Happy Birthday to Ononoki’s VA Saori!,,44,2022-05-28 15:01:18.000000,2022-05-29 03:17:55.354702,0 days 12:16:37.354702
uzv89w,starcitizen,"Everyone drooling on that Drake Mule. Meanwhile, in a back alley of A18...",,58,2022-05-28 20:15:08.000000,2022-05-29 03:17:55.354702,0 days 07:02:47.354702
uzwpew,StrangerThings,Joseph Quinn’s ‘Stranger Things’ Season 4 Performance as Eddie Munson,,100,2022-05-28 21:36:22.000000,2022-05-29 03:17:55.354702,0 days 05:41:33.354702
uzshrj,OculusQuest,Turning a simple cardboard box into an interactive VR Toy - Prototype,,34,2022-05-28 17:51:33.000000,2022-05-29 03:17:55.354702,0 days 09:26:22.354702
uzp79i,PerfectlyCutBooms,Perfectly cut electro boom,,19,2022-05-28 15:06:25.000000,2022-05-29 03:17:55.354702,0 days 12:11:30.354702
uzv85c,ImaginaryHorrors,"""Paper Ghosts"" by Lisa Steinberg",,7,2022-05-28 20:14:56.000000,2022-05-29 03:17:55.354702,0 days 07:02:59.354702
uzon26,HunterXHunter,The entire HxH fanbase this week,,25,2022-05-28 14:37:51.000000,2022-05-29 03:17:55.354702,0 days 12:40:04.354702
uzlhq4,blursed_videos,Blursed_father,,35,2022-05-28 11:36:14.000000,2022-05-29 03:17:55.354702,0 days 15:41:41.354702
uzvplv,darkestdungeon,(DD1 Modded Meme) I love the Veiled,,8,2022-05-28 20:41:30.000000,2022-05-29 03:17:55.354702,0 days 06:36:25.354702
uzy78k,GameTheorists,behold a meme that represents matpat on film theory in a nutshell,,5,2022-05-28 22:55:33.000000,2022-05-29 03:17:55.354702,0 days 04:22:22.354702
uzr9ox,Nijisanji,Hyakumantenbara Salome has hit 500.000 Subscribers! She is currently the fastest Vtuber to hit 500k Milestone with a record of 4 Days after debut!,,70,2022-05-28 16:50:33.000000,2022-05-29 03:17:55.354702,0 days 10:27:22.354702
uzsfrz,argentina,¡Puta que ofertón!,,45,2022-05-28 17:48:35.000000,2022-05-29 03:17:55.354702,0 days 09:29:20.354702
uzm7h1,Blep,Blep from my CatDog,,7,2022-05-28 12:21:40.000000,2022-05-29 03:17:55.354702,0 days 14:56:15.354702
uzzpvy,depression_memes,Winning therapy!,,1,2022-05-29 00:20:21.000000,2022-05-29 03:17:55.354702,0 days 02:57:34.354702
uzyayx,ChoosingBeggars,Didn't even have a chance to respond,,23,2022-05-28 23:01:10.000000,2022-05-29 03:17:55.354702,0 days 04:16:45.354702
uzq54a,weddingshaming,Woman is upset her fiancé owes back child support (to feed his children) and can’t afford her wedding 🥴,,208,2022-05-28 15:54:27.000000,2022-05-29 03:17:55.354702,0 days 11:23:28.354702
uzwl2s,mlb,Matt Carpenter looks like he’s about to give Arthur Morgan tuberculosis,,24,2022-05-28 21:29:45.000000,2022-05-29 03:17:55.354702,0 days 05:48:10.354702
uzqx93,masterduel,I guess I'm incredible at bluffing,,55,2022-05-28 16:32:48.000000,2022-05-29 03:17:55.354702,0 days 10:45:07.354702
uzodr3,CatsWhoSqueak,The morning alarm. 💕,,10,2022-05-28 14:23:59.000000,2022-05-29 03:17:55.354702,0 days 12:53:56.354702
uzwltq,dankmemes,The Onion made me sad today,,326,2022-05-28 21:30:54.000000,2022-05-29 03:17:55.354702,0 days 05:47:01.354702
uzmqka,evilbuildings,The Municipal Building in my town.,,38,2022-05-28 12:53:23.000000,2022-05-29 03:17:55.354702,0 days 14:24:32.354702
uzztmy,KamenRider,Revice Final Form,,108,2022-05-29 00:26:41.000000,2022-05-29 03:17:55.354702,0 days 02:51:14.354702
uzp9rk,F1Game,"After being fired by Codemasters, Jeff now works for Tony Stark",,59,2022-05-28 15:09:59.000000,2022-05-29 03:17:55.354702,0 days 12:07:56.354702
uztcvr,horror,Johnny Depp rumored to be in Beetlejuice 2,,95,2022-05-28 18:35:59.000000,2022-05-29 03:17:55.354702,0 days 08:41:56.354702
v003j9,gaybrosgonemild,Felt smoldering 😈,,25,2022-05-29 00:43:20.000000,2022-05-29 03:17:55.354702,0 days 02:34:35.354702
uzsse2,painting,"hi, i'm working on this beast of a painting one line at a time, 2nd year!",,43,2022-05-28 18:06:40.000000,2022-05-29 03:17:55.354702,0 days 09:11:15.354702
uzu4q0,AskThe_Donald,NRA Protestors Channel Their Spirit Animals,,70,2022-05-28 19:16:37.000000,2022-05-29 03:17:55.354702,0 days 08:01:18.354702
uzoeu0,Persona5,"Makoto in Training, or: What Yusuke Was Appreciating (commissioned from @xxibalbas)",,31,2022-05-28 14:25:41.000000,2022-05-29 03:17:55.354702,0 days 12:52:14.354702
uzutsm,GenUsa,I’m soooo tried of the “USSR won the space race actually” cope from even non-communists,,59,2022-05-28 19:53:32.000000,2022-05-29 03:17:55.354702,0 days 07:24:23.354702
uzm5dp,StarWars,Disney is really getting their moneys worth for the Tatooine set,,875,2022-05-28 12:18:00.000000,2022-05-29 03:17:55.354702,0 days 14:59:55.354702
uzt74l,apple,[Thread] Apple's WWDC will be the first of three different events that Apple is preparing for the next year introducing the world to augmented reality (a new form that we haven't seen yet),,146,2022-05-28 18:27:57.000000,2022-05-29 03:17:55.354702,0 days 08:49:58.354702
uzrslg,OneOrangeBraincell,Im worried Muffin may be broked.,,23,2022-05-28 17:16:01.000000,2022-05-29 03:17:57.013409,0 days 10:01:56.013409
uzyyo3,RedDeadOnline,Look familiar?,,16,2022-05-28 23:37:59.000000,2022-05-29 03:17:57.013409,0 days 03:39:58.013409
v00wmq,BadChoicesGoodStories,Meal Team 6,,23,2022-05-29 01:32:53.000000,2022-05-29 03:17:57.013409,0 days 01:45:04.013409
uzph49,jerma985,In Chicago for the weekend and stopped for some ramen. Forever grateful I did,,36,2022-05-28 15:20:19.000000,2022-05-29 03:17:57.013409,0 days 11:57:38.013409
uzxxmu,banned4life,This mom deserves some recognition whomever it was!,,39,2022-05-28 22:40:48.000000,2022-05-29 03:17:57.013409,0 days 04:37:09.013409
uzzrtb,disenchantment,My daughter and I at Ren Faire this year,,19,2022-05-29 00:23:34.000000,2022-05-29 03:17:57.013409,0 days 02:54:23.013409
uzlsnt,disneyvacation,How to sleep naked,,23,2022-05-28 11:56:39.000000,2022-05-29 03:17:57.013409,0 days 15:21:18.013409
uzlqau,StardustCrusaders,A sketch Araki drew in 2007 for a fan suffering from pulmonary stenosis whose favorite character was Prosciutto.,,26,2022-05-28 11:52:22.000000,2022-05-29 03:17:57.013409,0 days 15:25:35.013409
uzvuuh,thingsforants,Miniature pottery,,4,2022-05-28 20:49:39.000000,2022-05-29 03:17:57.013409,0 days 06:28:18.013409
uzrzlb,DungeonsAndDragons,"Umber Hulk that I didn't want to paint umber. I give you, Jewel Beetle!",,14,2022-05-28 17:25:33.000000,2022-05-29 03:17:57.013409,0 days 09:52:24.013409
uzsjho,asexuality,Representing at Pride today! I’m the only ace flag :),,8,2022-05-28 17:54:08.000000,2022-05-29 03:17:57.013409,0 days 09:23:49.013409
uzl6i3,TheLastAirbender,Seems like Zuko taught Aang how to breakdance-fight. Who did it better?,,116,2022-05-28 11:14:09.000000,2022-05-29 03:17:57.013409,0 days 16:03:48.013409
uzlh1j,PartyParrot,Basil the BIG EAGLE,,58,2022-05-28 11:34:55.000000,2022-05-29 03:17:57.013409,0 days 15:43:02.013409
uzri29,forhonor,I love finding randoms that can gank : ),,46,2022-05-28 17:02:03.000000,2022-05-29 03:17:57.013409,0 days 10:15:54.013409
uzup9c,Instagramreality,Everything about these photos kills me. Bonus: Her hilarious post which lead me to her profile.,,44,2022-05-28 19:46:54.000000,2022-05-29 03:17:57.013409,0 days 07:31:03.013409
uzm8lf,PrequelMemes,"Yeh, I'd be pretty mad too",,139,2022-05-28 12:23:39.000000,2022-05-29 03:17:57.013409,0 days 14:54:18.013409
uzqtts,brushybrushy,Sassy loves face brushies,,11,2022-05-28 16:27:52.000000,2022-05-29 03:17:57.013409,0 days 10:50:05.013409
uzpj6z,happycowgifs,This Cow's baby is very beautiful 😍,,18,2022-05-28 15:23:15.000000,2022-05-29 03:17:57.013409,0 days 11:54:42.013409
uzrses,tuckedinkitties,"Come yere, yeah little more, GOT YOU",,5,2022-05-28 17:15:46.000000,2022-05-29 03:17:57.013409,0 days 10:02:11.013409
uztjil,HIMYM,Boobs?,,16,2022-05-28 18:45:55.000000,2022-05-29 03:17:57.013409,0 days 08:32:02.013409
uzo2s5,pitbulls,Does a half pittie count 🥲,,56,2022-05-28 14:07:31.000000,2022-05-29 03:17:57.013409,0 days 13:10:26.013409
uzzofz,PokemonLegendsArceus,Still nice to have it.,,12,2022-05-29 00:17:59.000000,2022-05-29 03:17:57.013409,0 days 02:59:58.013409
uzt5hj,projectzomboid,What's a good player,,15,2022-05-28 18:25:42.000000,2022-05-29 03:17:57.013409,0 days 08:52:15.013409
uzx6q6,FoodPorn,Banh Mi,,27,2022-05-28 22:01:30.000000,2022-05-29 03:17:57.013409,0 days 05:16:27.013409
uzt7s9,EnterTheGungeon,Stay Calm Stay Collected Stay Focused,,57,2022-05-28 18:28:52.000000,2022-05-29 03:17:57.013409,0 days 08:49:05.013409
uzp1i7,PremierLeague,Jordan Pickford is the Castrol Save of the Season winner,,94,2022-05-28 14:58:49.000000,2022-05-29 03:17:57.013409,0 days 12:19:08.013409
uzvqpi,antiMLM,Well this seems unethical,,51,2022-05-28 20:43:05.000000,2022-05-29 03:17:57.013409,0 days 06:34:52.013409
uzyqus,misleadingthumbnails,New flesh eating tapeworm discovered in Florida,,22,2022-05-28 23:25:27.000000,2022-05-29 03:17:57.013409,0 days 03:52:30.013409
uzprsd,Xenoblade_Chronicles,How to fix your Apple Watch,,47,2022-05-28 15:35:39.000000,2022-05-29 03:17:57.013409,0 days 11:42:18.013409
uzm026,adhdmeme,Meds got me like,,102,2022-05-28 12:09:03.000000,2022-05-29 03:17:57.013409,0 days 15:08:54.013409
uzvl8z,alberta,It's not government overreach when the UCP does it.,,98,2022-05-28 20:35:07.000000,2022-05-29 03:17:57.013409,0 days 06:42:50.013409
uzvm9f,sanfrancisco,"San Francisco Giants manager Gabe Kapler to skip national anthem after Uvalde. ""I don't plan on coming out for the anthem going forward until I feel better about the direction of our country,"" he told reporters. - NBC News","
San Francisco Giants manager Gabe Kapler said Friday he will refuse to take the field for the pregame national anthem ""going forward,"" following the massacre at an elementary school in Uvalde, Texas.



""I don't plan on coming out for the anthem going forward until I feel better about the direction of our country,"" Kapler told reporters Friday before the Giants played the Cincinnati Reds.



**Kapler elaborated in a blog post published Friday on his website. In the post — titled ""Home of the Brave?"" — he appeared to blast the police response to the massacre as well as the U.S. gun lobby and the political status quo.**



""We elect our politicians to represent our interests. Immediately following this shooting, we were told we needed locked doors and armed teachers. We were given thoughts and prayers. We were told it could have been worse, and we just need love,"" Kapler wrote.



**""But we weren’t given bravery, and we aren’t free,"" he added. ""The police on the scene put a mother in handcuffs as she begged them to go in and save her children. They blocked parents trying to organize to charge in to stop the shooter, including a father who learned his daughter was murdered while he argued with the cops.**




""We aren’t free when politicians decide that the lobbyist and gun industries are more important than our children’s freedom to go to school without needing bulletproof backpacks and active shooter drills,"" Kapler wrote.



In the post, Kapler admitted that he ""felt like a coward"" for standing for the national anthem before his team's game against the New York Mets on Wednesday, a day after an 18-year-old killed 19 students and two teachers at Robb Elementary School.



""But I am not okay with the state of this country,"" he wrote. ""I wish I hadn’t let my discomfort compromise my integrity. I wish that I could have demonstrated what I learned from my dad, that when you’re dissatisfied with your country, you let it be known through protest. The home of the brave should encourage this.""



Daniel Arkin is a reporter for NBC News who focuses on popular culture and the entertainment industry, particularly film and television.




https://www.nbcnews.com/news/amp/rcna30971",94,2022-05-28 20:36:36.000000,2022-05-29 03:17:57.013409,0 days 06:41:21.013409
uzxbk9,awwnimate,A girl who becomes a cow if she eats and sleeps right away [Original],,6,2022-05-28 22:08:30.000000,2022-05-29 03:17:57.013409,0 days 05:09:27.013409
uzmakw,Jokes,"Husband: ""Scientists have found that men say about 10,000 words a day, while women say about 20,000...""","Wife (shouts from the kitchen): ""It's because we have to repeat everything twice to you blockheads!""

Husband: ""What?""",161,2022-05-28 12:27:16.000000,2022-05-29 03:17:57.013409,0 days 14:50:41.013409
uzmvrg,suspiciouslyspecific,Paranoia Intensifies,,20,2022-05-28 13:01:27.000000,2022-05-29 03:17:57.013409,0 days 14:16:30.013409
v001gb,NationalPark,"Voyagers National Park sunrise, Lake Kabetogama",,6,2022-05-29 00:39:54.000000,2022-05-29 03:17:57.013409,0 days 02:38:03.013409
uzq82f,valheim,Troll vs Abomination - this game looks outstanding,,84,2022-05-28 15:58:27.000000,2022-05-29 03:17:57.013409,0 days 11:19:30.013409
v00rnz,Showerthoughts,Hating on those Texas cops seems to be the first thing the left and right have agreed on in 10 years,,113,2022-05-29 01:24:07.000000,2022-05-29 03:17:57.013409,0 days 01:53:50.013409
uzqvyx,carporn,Toyota GR Yaris [1170x1170],,34,2022-05-28 16:30:55.000000,2022-05-29 03:17:57.013409,0 days 10:47:02.013409
uzr3jq,nba,Nikola Jokic in Sweden riding horses at ”Elitloppet” in Stockholm: “My dream is to move back to Serbia and train horses after my basketball career”,,263,2022-05-28 16:41:55.000000,2022-05-29 03:17:57.013409,0 days 10:36:02.013409
uzw49f,deadbydaylight,Solo Queue btw,,128,2022-05-28 21:04:07.000000,2022-05-29 03:17:57.013409,0 days 06:13:50.013409
uzx8fb,McMansionHell,"McMansion Row Dearborn, Michigan",,39,2022-05-28 22:03:59.000000,2022-05-29 03:17:57.013409,0 days 05:13:58.013409
uznqmo,Perfectfit,This sauce dish in my sink,,25,2022-05-28 13:49:59.000000,2022-05-29 03:17:57.013409,0 days 13:27:58.013409
uzzh35,oblivion,My life is complete…,,22,2022-05-29 00:06:10.000000,2022-05-29 03:17:57.013409,0 days 03:11:47.013409
uzlt1m,antimeme,literally.,,110,2022-05-28 11:57:23.000000,2022-05-29 03:17:57.013409,0 days 15:20:34.013409
uzvxjz,arcane,[s1 spoilers] He wasn't lying.,,20,2022-05-28 20:53:53.000000,2022-05-29 03:17:57.013409,0 days 06:24:04.013409
uzwz9v,bodybuilding,Peak week. Pro debut. Toronto pro 2022.,,61,2022-05-28 21:50:58.000000,2022-05-29 03:17:57.013409,0 days 05:26:59.013409
uzm87y,onejob,"Ah yes, Resident Evil II",,28,2022-05-28 12:23:00.000000,2022-05-29 03:17:57.013409,0 days 14:54:57.013409
uzq5av,scottthewoz,Scott Wozniak VS Scott Pilgrim,,67,2022-05-28 15:54:41.000000,2022-05-29 03:17:57.013409,0 days 11:23:16.013409
uzwot1,soccercirclejerk,Quadruple!,,46,2022-05-28 21:35:25.000000,2022-05-29 03:17:57.013409,0 days 05:42:32.013409
uzory9,lastimages,"Last pic of my grandmother taken 14 days ago.She left us this morning after a 6 month fight against pancreatic cancer at the age of 79. I love her so much, she was my friend and confident. A such beautiful soul, I miss you so much...",,37,2022-05-28 14:45:04.000000,2022-05-29 03:17:57.013409,0 days 12:32:53.013409
uzpg8g,NewGreentexts,Stealer's remorse,,50,2022-05-28 15:19:08.000000,2022-05-29 03:17:57.013409,0 days 11:58:49.013409
uzm4jv,PublicFreakout,POS assaults innocent workers is now using dad money to actively remove this video from the internet. Don't let it die.,,1129,2022-05-28 12:16:34.000000,2022-05-29 03:17:57.013409,0 days 15:01:23.013409
uzonkl,DBZDokkanBattle,"LR Ultra Ego Vegeta and UI Goku [LR ART Concept by ""DokkanDeity""]",,83,2022-05-28 14:38:34.000000,2022-05-29 03:17:57.013409,0 days 12:39:23.013409
uznbxp,wholesome,Love heals.,,29,2022-05-28 13:27:05.000000,2022-05-29 03:17:57.013409,0 days 13:50:52.013409
uzurr8,PiratePets,Bring your Pirate to work day,,8,2022-05-28 19:50:32.000000,2022-05-29 03:17:57.013409,0 days 07:27:25.013409
uzu9x7,oldhagfashion,Outfit for a post Eid Event. Tried to bring modern to the tradition. Pearl crusted culotte and chiffon top.,,56,2022-05-28 19:24:10.000000,2022-05-29 03:17:57.013409,0 days 07:53:47.013409
uzst1w,AlzheimersGroup,"A dozen, a hundred, it's impossible to tell...",,12,2022-05-28 18:07:40.000000,2022-05-29 03:17:57.013409,0 days 09:10:17.013409
uzptzi,pcmasterrace,Somebody just threw half of their k/d out on the street,,170,2022-05-28 15:38:45.000000,2022-05-29 03:17:57.013409,0 days 11:39:12.013409
uzrcnc,oddlysatisfying,Miniature pottery,,63,2022-05-28 16:54:49.000000,2022-05-29 03:17:57.013409,0 days 10:23:08.013409
uzp2y0,InfowarriorRides,The flag at half mast because of school shooting tells a great story,,103,2022-05-28 15:00:30.000000,2022-05-29 03:17:57.013409,0 days 12:17:27.013409
uzwscr,Smite,I just think Terra deserves a beach skin [OC] @radrobot1,,28,2022-05-28 21:40:39.000000,2022-05-29 03:17:57.013409,0 days 05:37:18.013409
uzvdwe,confidentlyincorrect,That word doesn't mean what you think it means,,34,2022-05-28 20:24:12.000000,2022-05-29 03:17:57.013409,0 days 06:53:45.013409
uzvrcs,HuTao_Mains,Hutao,,3,2022-05-28 20:44:02.000000,2022-05-29 03:17:57.013409,0 days 06:33:55.013409
uzww2y,NatureIsFuckingLit,🔥 Fish catches and eats the bird.,,62,2022-05-28 21:46:16.000000,2022-05-29 03:17:57.013409,0 days 05:31:41.013409
uzttzs,rugbyunion,Revenge is dish best served 13 years cold,,83,2022-05-28 19:01:13.000000,2022-05-29 03:17:57.013409,0 days 08:16:44.013409
uzpftv,footballmanagergames,Savescumming the youth intake like,,77,2022-05-28 15:18:31.000000,2022-05-29 03:17:57.013409,0 days 11:59:26.013409
uzwcpb,lostpause,Is there such a thing as a weeb Jedi?,,7,2022-05-28 21:16:58.000000,2022-05-29 03:17:57.013409,0 days 06:00:59.013409
uzs2si,physicsmemes,I can't think of a title for this,,25,2022-05-28 17:30:04.000000,2022-05-29 03:17:57.013409,0 days 09:47:53.013409
uzu85g,ireland,Virtue Signalling,,35,2022-05-28 19:21:37.000000,2022-05-29 03:17:57.013409,0 days 07:56:20.013409
uzxhco,TerminallyStupid,And they are connected HOW?,,9,2022-05-28 22:16:52.000000,2022-05-29 03:17:57.013409,0 days 05:01:05.013409
v01abv,euphoria,Just thought i’d post this as I just saw it. It was very out of the ordinary for hunter to post this so I wanted some opinions on reddit.,,34,2022-05-29 01:57:05.000000,2022-05-29 03:17:57.013409,0 days 01:20:52.013409
v00b04,PoliticalHumor,Whale then,,36,2022-05-29 00:56:07.000000,2022-05-29 03:17:57.013409,0 days 02:21:50.013409
uztgrp,mmamemes,Send me location,,44,2022-05-28 18:41:45.000000,2022-05-29 03:17:57.013409,0 days 08:36:12.013409
uzp18e,coolguides,A Man’s Guide To Beards,,137,2022-05-28 14:58:27.000000,2022-05-29 03:17:57.013409,0 days 12:19:30.013409
uzrgta,wallstreetbets,cramer raging about meme stocks - GME,,513,2022-05-28 17:00:20.000000,2022-05-29 03:17:57.013409,0 days 10:17:37.013409
uzxec7,Disneyland,Fresh Baked met Boba & Fennec today in Galaxy Edge 👀,,34,2022-05-28 22:12:40.000000,2022-05-29 03:17:57.013409,0 days 05:05:17.013409
uzvb3w,fromsoftware,"From demon's souls to Elden Ring, who is the strongest protagonist?",,274,2022-05-28 20:19:43.000000,2022-05-29 03:17:57.013409,0 days 06:58:14.013409
uzpdjx,MemePiece,Kumadori fr the most annoying CP9 member,,79,2022-05-28 15:15:12.000000,2022-05-29 03:17:57.013409,0 days 12:02:45.013409
uzqk6u,Portal,Redrew one of my favorite Portal 2 moments in isometric Pixelart,,25,2022-05-28 16:14:23.000000,2022-05-29 03:17:57.013409,0 days 11:03:34.013409
uzpz7c,techsupportgore,Before and after of a network switche refresh for a school district,,45,2022-05-28 15:46:10.000000,2022-05-29 03:17:57.013409,0 days 11:31:47.013409
uzz6eh,democrats,"Unpopular opinion off my chest. There! Yeah, I said it!",,15,2022-05-28 23:49:46.000000,2022-05-29 03:17:57.013409,0 days 03:28:11.013409
uzlv2n,WitchesVsPatriarchy,Happy Caturday,,106,2022-05-28 12:00:45.000000,2022-05-29 03:17:57.013409,0 days 15:17:12.013409
uzsqod,trees,hello everyone. i wanted to show off my Bald Cypress trees i grew from seed. these seedlings sprouted about 2 months ago,,128,2022-05-28 18:04:17.000000,2022-05-29 03:17:57.013409,0 days 09:13:40.013409
uzukaz,LandlordLove,This is how it would go if I were to have an honest conversation with my parents.,,9,2022-05-28 19:39:25.000000,2022-05-29 03:17:57.013409,0 days 07:38:32.013409
uzkj82,bestoftheinternet,sing along with Ed Edd n eddy,,98,2022-05-28 10:25:45.000000,2022-05-29 03:17:57.013409,0 days 16:52:12.013409
uzksav,byebyejob,Elementary school principal now fired after dragging special needs student through school,[https://sports.yahoo.com/tennessee-principal-fired-dragging-special-011538611.html](https://sports.yahoo.com/tennessee-principal-fired-dragging-special-011538611.html),142,2022-05-28 10:45:22.000000,2022-05-29 03:17:57.013409,0 days 16:32:35.013409
uzvxe3,battlefield2042,Forgot to replace the batteries of the detonator..,,50,2022-05-28 20:53:39.000000,2022-05-29 03:17:57.013409,0 days 06:24:18.013409
uznlvp,2meirl42meirl4meirl,2meirl42meirl4meirl,,8,2022-05-28 13:42:37.000000,2022-05-29 03:17:57.013409,0 days 13:35:20.013409
uzsthg,Austria,My dog peed Austria on the carpet.,,33,2022-05-28 18:08:19.000000,2022-05-29 03:17:57.013409,0 days 09:09:38.013409
uzw8bt,snakes,Beware of natural spaghetti.,,24,2022-05-28 21:10:19.000000,2022-05-29 03:17:57.013409,0 days 06:07:38.013409
uzy5dj,AlisonBrie,Esquire - May 2013,,3,2022-05-28 22:52:30.000000,2022-05-29 03:17:57.013409,0 days 04:25:27.013409
uzw6b5,samoyeds,Picked up our lovely lady today! 😌,,16,2022-05-28 21:07:11.000000,2022-05-29 03:17:57.013409,0 days 06:10:46.013409
uzogic,WarplanePorn,Can you please help me identify these planes ? [1000×668],,107,2022-05-28 14:28:18.000000,2022-05-29 03:17:57.013409,0 days 12:49:39.013409
uzyr8e,hmmm,hmmm,,9,2022-05-28 23:26:03.000000,2022-05-29 03:17:57.013409,0 days 03:51:54.013409
uzol2y,BoneAppleTea,But I wish my car did have a taco meter.,,60,2022-05-28 14:34:59.000000,2022-05-29 03:17:57.013409,0 days 12:42:58.013409
uzsk1u,AquaSama,Finally 😇,,15,2022-05-28 17:55:01.000000,2022-05-29 03:17:57.013409,0 days 09:22:56.013409
uzqb2x,GlobalOffensive,NaVi: -Boombl4,,632,2022-05-28 16:02:05.000000,2022-05-29 03:17:57.013409,0 days 11:15:52.013409
uzr0an,formula1,Lewis with a Ferrari team member after quali,,251,2022-05-28 16:37:07.000000,2022-05-29 03:17:57.013409,0 days 10:40:50.013409
uzrwf3,MachinePorn,"Thrust SSC,taken at the Coventry Transport Museum today.",,14,2022-05-28 17:21:12.000000,2022-05-29 03:17:57.013409,0 days 09:56:45.013409
uzqpda,RedditLaqueristas,Neon Micro French ft. Cirque Colors - Pyro,,20,2022-05-28 16:21:25.000000,2022-05-29 03:17:58.935615,0 days 10:56:33.935615
uzqkri,worldbuilding,Eri Lichtbringer: Introduction of the military in Servannian Confederation.,,58,2022-05-28 16:15:05.000000,2022-05-29 03:17:58.935615,0 days 11:02:53.935615
uztlc2,ukraine,"A little 🇺🇦 girl hug her beloved ❤ cat while getting evacuated from railway station, Pokrovsk, Donetsk region.",,105,2022-05-28 18:48:42.000000,2022-05-29 03:17:58.935615,0 days 08:29:16.935615
uzj0m2,golf,My sons swing progress over 6 months.,,329,2022-05-28 08:28:36.000000,2022-05-29 03:17:58.935615,0 days 18:49:22.935615
uzzm5o,PERSoNA,Same VA Girls,,16,2022-05-29 00:14:15.000000,2022-05-29 03:17:58.935615,0 days 03:03:43.935615
uzp7lh,formuladank,Now try not to bin in the race tomorrow please,,58,2022-05-28 15:06:53.000000,2022-05-29 03:17:58.935615,0 days 12:11:05.935615
uzv6mi,nothingeverhappens,It’s not a scam according to OP,,34,2022-05-28 20:12:34.000000,2022-05-29 03:17:58.935615,0 days 07:05:24.935615
uzsejo,Genshin_Impact_Leaks,Some image from 2.7 Quest,,152,2022-05-28 17:46:43.000000,2022-05-29 03:17:58.935615,0 days 09:31:15.935615
uzxp8j,MLBTheShow,Well I was excited for a bit lol,,52,2022-05-28 22:28:21.000000,2022-05-29 03:17:58.935615,0 days 04:49:37.935615
uzufky,Bondedpairs,small glimpse of their life,,4,2022-05-28 19:32:34.000000,2022-05-29 03:17:58.935615,0 days 07:45:24.935615
